[
  {
    "entry_id": "rag.retrieval_k.v1",
    "schema_version": "1.0.0",
    "name": "retrieval_k",
    "range_type": "IntRange",
    "range_kwargs": {
      "low": 1,
      "high": 5
    },
    "kind": "cardinality",
    "effectuation_status": "manual_guidance",
    "category": "retrieval",
    "reasoning": "Measured HotpotQA demo isolation showed answer EM improved when retrieving more context, but the slice is small.",
    "impact_estimate": "medium",
    "agent_types": [
      "rag"
    ],
    "evidence_refs": [
      {
        "scope": "isolation",
        "metric": "answer_em",
        "n": 10,
        "model": "bedrock/us.anthropic.claude-haiku-4-5",
        "baseline": "1",
        "candidate": "5",
        "delta": 0.1,
        "limitations": [
          "single_slice",
          "not_sota"
        ]
      }
    ],
    "apply_guidance": "Manual wiring: after `cfg = traigent.get_config()`, read cfg['retrieval_k'] and pass it into your retriever's top-k or limit argument for each query. Keep the existing baseline value covered and add eval cases across the 1..5 range. NOTE: apply_config() only inserts the decorator + imports; it does not change retriever calls.",
    "status": "active",
    "version": "1.0.0"
  },
  {
    "entry_id": "code_gen.schema_context.v1",
    "schema_version": "1.0.0",
    "name": "schema_context",
    "range_type": "Choices",
    "range_kwargs": {
      "values": [
        "none",
        "full_ddl_fk",
        "linked_top6",
        "linked_top10"
      ]
    },
    "kind": "topology",
    "effectuation_status": "manual_guidance",
    "category": "structural",
    "reasoning": "Measured BIRD and Spider demo isolation runs showed schema context can materially improve SQL execution accuracy.",
    "impact_estimate": "high",
    "agent_types": [
      "code_gen"
    ],
    "evidence_refs": [
      {
        "scope": "isolation",
        "metric": "execution_accuracy",
        "n": 10,
        "model": "bedrock/us.anthropic.claude-haiku-4-5",
        "baseline": "none",
        "candidate": "linked_top6",
        "delta": 0.4,
        "limitations": [
          "single_slice",
          "not_sota"
        ]
      },
      {
        "scope": "isolation",
        "metric": "execution_accuracy",
        "n": 10,
        "model": "bedrock/us.anthropic.claude-haiku-4-5",
        "baseline": "none",
        "candidate": "full_ddl_fk",
        "delta": 0.3,
        "limitations": [
          "single_slice",
          "not_sota"
        ]
      }
    ],
    "apply_guidance": "Manual wiring: after `cfg = traigent.get_config()`, branch on cfg['schema_context']: 'none' sends no schema; 'full_ddl_fk' injects full DDL+FK text; 'linked_top6'/'linked_top10' inject the top-k schema-linked lines. Add eval coverage for the baseline and each branch. NOTE: apply_config() only inserts the @traigent.optimize decorator + imports; it does NOT wire this runtime branch - you do.",
    "status": "active",
    "version": "1.0.0"
  },
  {
    "entry_id": "code_gen.evidence_usage.v1",
    "schema_version": "1.0.0",
    "name": "evidence_usage",
    "range_type": "Choices",
    "range_kwargs": {
      "values": [
        "off",
        "hint_appended"
      ]
    },
    "kind": "topology",
    "effectuation_status": "manual_guidance",
    "category": "structural",
    "reasoning": "Measured BIRD demo isolation showed appended evidence hints can improve execution accuracy on a small slice.",
    "impact_estimate": "medium",
    "agent_types": [
      "code_gen"
    ],
    "evidence_refs": [
      {
        "scope": "isolation",
        "metric": "execution_accuracy",
        "n": 10,
        "model": "bedrock/us.anthropic.claude-haiku-4-5",
        "baseline": "off",
        "candidate": "hint_appended",
        "delta": 0.1,
        "limitations": [
          "single_slice",
          "not_sota"
        ]
      }
    ],
    "apply_guidance": "Manual wiring: after `cfg = traigent.get_config()`, branch on cfg['evidence_usage']: 'off' leaves the prompt unchanged; 'hint_appended' appends retrieved schema or value evidence as a hint section before generation. Add eval coverage for off and hint_appended. NOTE: apply_config() only inserts the decorator + imports; runtime prompt wiring remains your code.",
    "status": "active",
    "version": "1.0.0"
  },
  {
    "entry_id": "code_gen.fewshot_selector.v1",
    "schema_version": "1.0.0",
    "name": "fewshot_selector",
    "range_type": "Choices",
    "range_kwargs": {
      "values": [
        "random",
        "masked_question_similarity",
        "dail_selection"
      ]
    },
    "kind": "topology",
    "effectuation_status": "manual_guidance",
    "category": "prompting",
    "reasoning": "Spider significance data indicates few-shot selection matters, but this signal is observational rather than causal.",
    "impact_estimate": "medium",
    "agent_types": [
      "code_gen"
    ],
    "evidence_refs": [
      {
        "scope": "significance",
        "metric": "importance",
        "n": 200,
        "model": "bedrock/us.anthropic.claude-haiku-4-5",
        "baseline": "observational",
        "candidate": "fewshot_selector",
        "delta": null,
        "limitations": [
          "observational_not_causal"
        ]
      }
    ],
    "apply_guidance": "Manual wiring: after `cfg = traigent.get_config()`, branch on cfg['fewshot_selector']: 'random' samples examples uniformly, 'masked_question_similarity' selects nearest masked-question examples, and 'dail_selection' uses the DAIL selection path. Add eval coverage for each selector because this evidence is observational, not causal. NOTE: apply_config() only inserts the decorator + imports; selector implementation remains your code.",
    "status": "active",
    "version": "1.0.0"
  },
  {
    "entry_id": "code_gen.generation_path.v1",
    "schema_version": "1.0.0",
    "name": "generation_path",
    "range_type": "Choices",
    "range_kwargs": {
      "values": [
        "direct_dail",
        "query_plan_cot",
        "divide_conquer_cot"
      ]
    },
    "kind": "topology",
    "effectuation_status": "manual_guidance",
    "category": "prompting",
    "reasoning": "Generation path had low or zero isolated lift in demos, but can contribute when combined with schema, examples, and repair.",
    "impact_estimate": "low",
    "agent_types": [
      "code_gen"
    ],
    "evidence_refs": [
      {
        "scope": "isolation",
        "metric": "execution_accuracy",
        "n": 10,
        "model": "bedrock/us.anthropic.claude-haiku-4-5",
        "baseline": "direct_dail",
        "candidate": "query_plan_cot",
        "delta": 0.0,
        "limitations": [
          "low_or_zero_in_isolation",
          "gains_are_joint"
        ]
      },
      {
        "scope": "isolation",
        "metric": "execution_accuracy",
        "n": 10,
        "model": "bedrock/us.anthropic.claude-haiku-4-5",
        "baseline": "direct_dail",
        "candidate": "query_plan_cot",
        "delta": 0.0,
        "limitations": [
          "low_or_zero_in_isolation",
          "gains_are_joint"
        ]
      }
    ],
    "apply_guidance": "Manual wiring: after `cfg = traigent.get_config()`, branch on cfg['generation_path']: 'direct_dail' uses direct SQL generation, 'query_plan_cot' prompts for a plan before SQL, and 'divide_conquer_cot' decomposes the question before composing SQL. Add eval coverage for each path and interpret isolated wins cautiously. NOTE: apply_config() only inserts the decorator + imports; generation control flow remains your code.",
    "status": "active",
    "version": "1.0.0"
  },
  {
    "entry_id": "code_gen.fewshot_k.v1",
    "schema_version": "1.0.0",
    "name": "fewshot_k",
    "range_type": "IntRange",
    "range_kwargs": {
      "low": 0,
      "high": 10,
      "default": 3
    },
    "kind": "cardinality",
    "effectuation_status": "manual_guidance",
    "category": "prompting",
    "reasoning": "Few-shot count had low or zero isolated lift in demos, but can matter jointly with selector and schema context.",
    "impact_estimate": "low",
    "agent_types": [
      "code_gen"
    ],
    "evidence_refs": [
      {
        "scope": "isolation",
        "metric": "execution_accuracy",
        "n": 10,
        "model": "bedrock/us.anthropic.claude-haiku-4-5",
        "baseline": "0",
        "candidate": "3",
        "delta": 0.0,
        "limitations": [
          "low_or_zero_in_isolation",
          "gains_are_joint"
        ]
      },
      {
        "scope": "isolation",
        "metric": "execution_accuracy",
        "n": 10,
        "model": "bedrock/us.anthropic.claude-haiku-4-5",
        "baseline": "0",
        "candidate": "3",
        "delta": 0.0,
        "limitations": [
          "low_or_zero_in_isolation",
          "gains_are_joint"
        ]
      }
    ],
    "apply_guidance": "Manual wiring: after `cfg = traigent.get_config()`, read cfg['fewshot_k'] and use it as the number of few-shot examples emitted by whichever selector is active; 0 means no examples. Add eval coverage for 0 and the upper range. NOTE: apply_config() only inserts the decorator + imports; example selection remains your code.",
    "status": "active",
    "version": "1.0.0"
  },
  {
    "entry_id": "code_gen.candidate_count.v1",
    "schema_version": "1.0.0",
    "name": "candidate_count",
    "range_type": "IntRange",
    "range_kwargs": {
      "low": 1,
      "high": 3
    },
    "kind": "cardinality",
    "effectuation_status": "manual_guidance",
    "category": "generation",
    "reasoning": "Spider significance data indicates candidate count matters, but this signal is observational rather than causal.",
    "impact_estimate": "low",
    "agent_types": [
      "code_gen"
    ],
    "evidence_refs": [
      {
        "scope": "significance",
        "metric": "importance",
        "n": 200,
        "model": "bedrock/us.anthropic.claude-haiku-4-5",
        "baseline": "observational",